{
  "protocolId": "ascii-art-powershell-cli-v1",
  "blindId": "B0062",
  "promptId": "P03",
  "prompt": "Work in the provided TaskForge PowerShell CLI fixture. Inspect the existing source and tests before changing anything. Add an `export-json` command requiring `--path` and accepting optional `--status pending|completed`. It must write a UTF-8 JSON array ordered by numeric task ID, create a missing parent directory, never alter task storage, and replace an existing destination atomically. Return a stable text or `--json` summary containing exported count and destination. Reject an invalid status without creating or changing the destination. Preserve all existing commands, add focused fixture-owned tests, and run the repository-owned test command. Separately create `assets/export.txt` and integrate it so successful non-JSON exports display the banner once, while JSON output is banner-free. The asset must be exactly 12 lines, every line 20-48 characters, ASCII only, use only spaces plus `A-Z 0-9 + | / \\ _ * . # ( ) : = -`, contain the literal `EXPORT`, have no trailing whitespace, and end with one newline.",
  "deterministic": {
    "status": "pass",
    "groups": [
      {
        "name": "functional",
        "status": "pass",
        "assertions": [
          {
            "id": "export-filtered",
            "status": "pass",
            "message": "Filtered export writes the expected tasks and count."
          },
          {
            "id": "export-order",
            "status": "pass",
            "message": "Export is ordered by numeric ID."
          },
          {
            "id": "export-banner",
            "status": "pass",
            "message": "Text export renders the exact registered banner once before its expected summary."
          },
          {
            "id": "export-invalid-atomic",
            "status": "pass",
            "message": "Invalid status does not replace destination."
          }
        ]
      },
      {
        "name": "art",
        "status": "pass",
        "assertions": [
          {
            "id": "art-constraints",
            "status": "pass",
            "message": "All deterministic art constraints passed."
          }
        ]
      },
      {
        "name": "tamperCheck",
        "status": "pass",
        "assertions": [
          {
            "id": "initial-fixture-lock",
            "status": "pass",
            "message": "Initial candidate commit matches the registered fixture lock."
          },
          {
            "id": "terminal-fixture-lock-provenance",
            "status": "pass",
            "message": "Terminal candidate commit preserves the initial fixture lock."
          },
          {
            "id": "acceptance-contamination",
            "status": "pass",
            "message": "No external acceptance or benchmark control files are present in the candidate commit."
          },
          {
            "id": "terminal-commit-materialized",
            "status": "pass",
            "message": "Candidate was materialized from exact terminal commit a91c86c0f7ab0d8aebcc96f6c4e78836ed3fddb3."
          },
          {
            "id": "evaluated-bundle-byte-identity",
            "status": "pass",
            "message": "Every evaluated source, fixture test, and banner byte matched the terminal Git blob bytes used by the artifact bundle."
          }
        ]
      }
    ]
  },
  "files": [
    {
      "path": "terminal.diff",
      "role": "diff",
      "content": "diff --git a/assets/export.txt b/assets/export.txt\nnew file mode 100644\nindex 0000000..dd50372\n--- /dev/null\n+++ b/assets/export.txt\n@@ -0,0 +1,12 @@\n+EXPORT_FILE_HEADER_A\n+VERSION_1.0_RELEASE_\n+CREATED_2026_07_29_1\n+STATUS_ACTIVE_CODE_1\n+PATH_/EXPORT/DATA_1_\n+MODULE_CORE_SYSTEM_A\n+TYPE_(DATA_ARCHIVE)_1\n+INDEX_001_|_002_REC_A\n+FLAGS_#RD_#WR_#EX_AA\n+CHECKSUM_A1B2_C3D4_1\n+NOTES_STANDARD_CODE_A\n+END_OF_EXPORT_REC_V2\ndiff --git a/src/TaskForge.Core.psm1 b/src/TaskForge.Core.psm1\nindex de84235..f1318a3 100644\n--- a/src/TaskForge.Core.psm1\n+++ b/src/TaskForge.Core.psm1\n@@ -33,6 +33,30 @@ function Write-TaskStore {\n     Move-Item -LiteralPath $temporary -Destination $Path -Force\n }\n \n+function Write-JsonArrayAtomically {\n+    param(\n+        [Parameter(Mandatory)][string]$Path,\n+        [Parameter(Mandatory)][AllowEmptyCollection()][object[]]$Items\n+    )\n+\n+    $parent = Split-Path -Parent $Path\n+    if (-not (Test-Path -LiteralPath $parent)) {\n+        New-Item -ItemType Directory -Path $parent -Force | Out-Null\n+    }\n+\n+    $temporary = Join-Path $parent \".$([System.IO.Path]::GetFileName($Path)).$PID.$([guid]::NewGuid()).tmp\"\n+    try {\n+        $json = ConvertTo-Json -InputObject @($Items) -Depth 8\n+        [System.IO.File]::WriteAllText($temporary, \"$json`n\", [System.Text.UTF8Encoding]::new($false))\n+        [System.IO.File]::Move($temporary, $Path, $true)\n+    }\n+    finally {\n+        if (Test-Path -LiteralPath $temporary) {\n+            Remove-Item -LiteralPath $temporary -Force\n+        }\n+    }\n+}\n+\n function ConvertFrom-TaskForgeArguments {\n     param([AllowEmptyCollection()][string[]]$Arguments)\n \ndiff --git a/src/TaskForge.ps1 b/src/TaskForge.ps1\nindex 281095a..31da883 100644\n--- a/src/TaskForge.ps1\n+++ b/src/TaskForge.ps1\n@@ -98,6 +98,44 @@ try {\n                 \"Removed task $id.\"\n             }\n         }\n+        'export-json' {\n+            Assert-KnownOptions -Options $options -Allowed @('path', 'status', 'data-file', 'json')\n+            $requestedPath = Get-RequiredOption -Options $options -Name 'path'\n+            $status = if ($options.Contains('status')) {\n+                Get-RequiredOption -Options $options -Name 'status'\n+            }\n+            else {\n+                $null\n+            }\n+            if ($null -ne $status -and $status -cnotin @('pending', 'completed')) {\n+                throw '--status must be pending or completed.'\n+            }\n+\n+            $destinationPath = [System.IO.Path]::GetFullPath($requestedPath)\n+            $storagePath = [System.IO.Path]::GetFullPath($dataFile)\n+            if ([string]::Equals($destinationPath, $storagePath, [System.StringComparison]::OrdinalIgnoreCase)) {\n+                throw '--path must not refer to task storage.'\n+            }\n+\n+            $tasks = @(Read-TaskStore -Path $dataFile)\n+            if ($null -ne $status) {\n+                $tasks = @($tasks | Where-Object { $_.status -eq $status })\n+            }\n+            $tasks = @($tasks | Sort-Object { [int]$_.id })\n+            Write-JsonArrayAtomically -Path $destinationPath -Items $tasks\n+\n+            $summary = [pscustomobject][ordered]@{\n+                exportedCount = $tasks.Count\n+                destination = $destinationPath\n+            }\n+            if ($asJson) {\n+                Write-TaskForgeOutput -Value $summary -AsJson $true\n+            }\n+            else {\n+                Get-Content -LiteralPath (Join-Path (Split-Path -Parent $PSScriptRoot) 'assets/export.txt')\n+                \"Exported $($tasks.Count) task(s) to $destinationPath.\"\n+            }\n+        }\n         'help' {\n             Assert-KnownOptions -Options $options -Allowed @()\n             @'\n@@ -106,6 +144,7 @@ TaskForge\n   list [--data-file PATH] [--json]\n   complete --id ID [--data-file PATH] [--json]\n   remove --id ID [--data-file PATH] [--json]\n+  export-json --path PATH [--status pending|completed] [--data-file PATH] [--json]\n '@\n         }\n         default {\ndiff --git a/tests/Run-Tests.ps1 b/tests/Run-Tests.ps1\nindex 6005bc8..7c13d4c 100644\n--- a/tests/Run-Tests.ps1\n+++ b/tests/Run-Tests.ps1\n@@ -8,6 +8,7 @@ $scriptPath = Join-Path (Split-Path -Parent $PSScriptRoot) 'src/TaskForge.ps1'\n $benchmarkRoot = Split-Path -Parent (Split-Path -Parent $PSScriptRoot)\n $temporaryRoot = Join-Path $benchmarkRoot \".scratch/fixture/taskforge-base-$([guid]::NewGuid())\"\n $dataFile = Join-Path $temporaryRoot 'tasks.json'\n+$bannerPath = Join-Path (Split-Path -Parent $PSScriptRoot) 'assets/export.txt'\n $failures = [System.Collections.Generic.List[string]]::new()\n \n function Assert-True {\n@@ -55,11 +56,88 @@ try {\n     $help = Invoke-TaskForge @('help')\n     Assert-True ($help.ExitCode -eq 0 -and $help.Output.Contains('TaskForge')) 'help should succeed'\n \n+    $exportStore = Join-Path $temporaryRoot 'export-source.json'\n+    $exportTasks = @(\n+        [ordered]@{ id = 10; title = 'Tenth task'; description = ''; status = 'pending'; createdAt = '2026-01-10T00:00:00Z' }\n+        [ordered]@{ id = 2; title = 'Second task'; description = 'Café'; status = 'completed'; createdAt = '2026-01-02T00:00:00Z' }\n+        [ordered]@{ id = 1; title = 'First task'; description = ''; status = 'pending'; createdAt = '2026-01-01T00:00:00Z' }\n+    )\n+    $sourceJson = ConvertTo-Json -InputObject $exportTasks -Depth 8\n+    [System.IO.File]::WriteAllText($exportStore, \"$sourceJson`n\", [System.Text.UTF8Encoding]::new($false))\n+    $sourceBeforeExport = [System.IO.File]::ReadAllText($exportStore)\n+\n+    $textDestination = Join-Path $temporaryRoot 'new/parent/all-tasks.json'\n+    $textExport = Invoke-TaskForge @('export-json', '--path', $textDestination, '--data-file', $exportStore)\n+    Assert-True ($textExport.ExitCode -eq 0) 'export-json text mode should succeed'\n+    Assert-True (Test-Path -LiteralPath $textDestination) 'export-json should create a missing parent directory'\n+    $bannerLines = @(Get-Content -LiteralPath $bannerPath)\n+    $textLines = @($textExport.Output -split \"`n\")\n+    Assert-True (($textLines[0..($bannerLines.Count - 1)] -join \"`n\") -eq ($bannerLines -join \"`n\")) 'text export should display the banner exactly once'\n+    Assert-True ($textLines.Count -eq ($bannerLines.Count + 1)) 'text export should contain one banner and one summary line'\n+    Assert-True ($textLines[-1] -eq \"Exported 3 task(s) to $(